{"artifactSetSha256":"d03f0c47f50b5af1a475a5c416b3ca7ae44410f728178f058d65238702db2e39","buildInputsSha256":"648220f0fb543de7a91326553fe51cd74cecd8488c76e963ccbc9fe99560108a","correlations":[{"entryFileId":"file:runtime:failure-callbacks","id":"correlation:failure-callbacks","layers":[{"format":"wordpresshx.php-haxe-range-map.v1","generatedFileId":"file:runtime:failure-callbacks","generatedLanguage":"php","mapFileId":"file:map:failure-callbacks","order":0,"sourceFileIds":["file:source:fixture:source-correlation"],"sourceLanguage":"haxe"}],"proofReceiptIds":["SDK-025-PHP-SOURCE-CORRELATION"],"status":"bounded-local","strategy":"php-range-map","target":"php"}],"files":[{"byteLength":7320,"distribution":"local-only","id":"file:map:failure-callbacks","language":"json","path":"includes/FailureCallbacks.php.haxe-map.json","role":"source-map","sha256":"ce46582290e053a6ed434e8215394d3d6e6fc4599de1e182ce42b319c2a80bd9"},{"byteLength":1472,"distribution":"production","id":"file:runtime:failure-callbacks","language":"php","path":"includes/FailureCallbacks.php","role":"runtime","sha256":"d3534a6374ebec4ded2265850d93fb0be6f2b73c55f4ac213cbb6e811db00dc2"},{"byteLength":1061,"distribution":"debug-companion","id":"file:source:fixture:source-correlation","language":"haxe","path":"source/project/compiler/wordpress/test/fixtures/SourceCorrelationCallbacks.hx","role":"source","sha256":"d274806fe5ae2ac89709f8568797723dee701044ec31cfe6ceeccd58f38cb833","sourceIdentity":{"path":"compiler/wordpress/test/fixtures/SourceCorrelationCallbacks.hx","rootId":"project"}}],"format":"wordpresshx.source-correlation-index.v1","package":{"id":"source-correlation-fixture","profileId":"wp70-release","version":"0.0.0"},"retention":{"developmentHandler":"disabled","indexDistribution":"local-only","inlineMapsInProduction":false,"machinePathsAllowed":false,"mapsInProduction":false,"profile":"development","secretScanRequiredForShipping":true,"sourceContentPolicy":"allowlisted-debug-only"},"schemaVersion":1,"sdkVersion":"0.0.0+sdk025","sourceRoots":[{"contentDistribution":"debug-companion","id":"project","kind":"project","packagePath":"source/project","resolution":"debug-companion-relative"}]}
